n;r;co;p;ca;t;s;a
Lazaro;Humano (rol mapa mundi);Cuando era bebé fue rescatado por los piratas del cartel pantoque, ellos le criaron y educaron a su manera de ver la vida. Cuando fue mayor se marchó en busca de aventuras y encontró a los heroes en una casa de subastas de humancraft;Lazaro es un loco aventurero, que se burla de los problemas y se lanza a la batalla sin pensar. Es imprudente, llegando a veces a poner su vida en riesgo sin parecer importarle demasiado pues se considera capaz de esquivar cualquier golpe.;sin campaña;trama base;subtrama base;False
Ajira;Ninfa;Ajira dedica su vida a conocer nuevos mares, estudiar la vida marina y divertirse por el camino. Su padre, que era pescador, le contaba de chiquita mientras le preparaba la cena, que existían todo tipo de peces en los mares del mundo y que su sueño era probarlos todos. Cuando su padre murio Ajira se prometio que cumpliría su sueño.;Ajira es alegre y extrovertida, adora viajar con buenas compañias que no le amarguen los viajes y compartan intereses con ella. Odia robar y pierde un poco los nervios cuando le mienten.;sin campaña;trama base;subtrama base;False
Jaskier;Kobold;Jaskier no recuerda como nació, no sabe de donde viene pero si a donde va. huye de la pobreza, el latrocinio y la desdicha que reina entre los suyos y a lomos de su poni, cabalga por el mundo haciendo lo que mas le gusta, cantar sus gestas.;Jaskier es atrevido, le gusta crear problemas con sus canciones y adora la confrontación. Siempre que va acompañado es el mas valiente, pero solo.. digamos que se encoge un poco.;sin campaña;trama base;subtrama base;False
Tormesia;Elfo (rol mapa mundi);Eres totalmente antirol hijo mio.;Rellena un fisco puto vago.;sin campaña;trama base;subtrama base;False
Anub-erod;jacquar;Anub viene de la cuenca del rio osri en el desierto de otun, allí vivia con su hermano jacquet y su padre jac. Su padre es un famoso profesor de arqueología y teólogo que trabaja para la escuela de magos local y de quien anub aprendió todo.;Anub es una persona bondadosa, aunque tosco y agresivo. Con el cerca deberás de mostrar respeto por la religión, los mayores y el conocimiento. Si bien es un personaje legal, su máxima no es seguir las normas sino su própio código ético. Anub siempre protegerá a los mayores y las personas en peligro siempre y cuando les considere dignos de ello. también evitará por todos los medios matar a alguien siempre y cuando su propia vida no corra peligro, o si esa persona no le ha causado algún problema personal.;zorvintal;inicio;partida 2;False
Eren;Humano;Eren es un humano muy enigmático que guarda con recelo su vida previa a la licantropía. De el solo se sabe que proviene de una arboleda druídica donde fue criado y vivió hasta hace pocos años cuando conoció a alexstrasza y chuck.;Eren odia la tecnología y reniega de la sociedad. Se encuentra terriblemente fuera de lugar en una ciudad y generalmente prefiere ni entrar a ellas. En la naturaleza es un hombre amable que suele ayudar a los animales y guiar a las personas cuando se pierden en sus dominios.;zorvintal;inicio;partida 2;False
asherati barbaro;Asherati;Eres totalmente antirol hijo mio.;Rellena un fisco puto vago.;zorvintal;inicio;partida 4;False
asherati mago;Asherati;Eres totalmente antirol hijo mio.;Rellena un fisco puto vago.;zorvintal;inicio;partida 4;False